"user_input","retrieved_contexts","response","reference","faithfulness","answer_relevancy","context_precision","context_recall","completeness","formatted_contexts"
"What tournament was before Champions League?","['If the precessor, European Cup, is not counted the Champions League started in 1992. Although, when statistics are presented for Champions League it is common that Champions League and European League are accumulated.', 'The UEFA Champions League came about as a new version of the European Cup and was played for the first time in the 1992-1993 season. Already established as the most prestigious club tournament in football, Champions League has become even more popular with the introduction of a mini-league group stage system. The new concept had a resemblance to the FIFA World Cup with an early phase of group play followed by a knockout phase. On several occasions has the competition expanded to include more', 'What distinguish the Champions League from European Cup is for many the group play instead of the round-robin format. The fact is, however, that a group stage was introduced already in 1991, but the reshaping became formalised by the name shift. In the development of the competition a hybrid-form of group play and round-robin has evolved.', 'In the third edition of the Champions League (1994-1995), the tournament expanded to 16 teams (excluding the qualification). The format consisted of a group phase with four groups followed by three knockout stages.\n\nIn season 1997-1998 another expansion added more teams to 24 (excluding the qualification). A group phase, including six groups, was followed by a knockout phase in three stages.', 'Format and participating teams\nIn the first edition (1992-1993), the tournament consisted of 8 teams after a qualification phase. The eight teams were playing in two groups followed by a final between the group winners. The first season included in total 36 participating clubs in the qualification, since when the numbers have increased.', ""The tournaments have so far been dominated by the top European clubs and few surprise victories have occurred. Perhaps Porto's victory in 2004 should be counted as the biggest surprise. Potential sensations that could have happened was Nantes in 1995-96 that almost managed to go through Juventus in the semi-finals (lost 3-4 on aggregate). If Dynamo Kyiv had won in 1998-99 it would also be seen as a sensation; they were only one goal down on aggregation against Bayern Munich in the semi-finals.""]","The tournament before Champions League was the European Cup.","European Cup was tournament before Champions League.","1.0","0.9902049462607363","0.9999999999666667","1.0","0.9802","
[1] If the precessor, European Cup, is not counted the Champions League started in 1992. Although, when statistics are presented for Champions League it is common that Champions League and European League are accumulated.
[2] The UEFA Champions League came about as a new version of the European Cup and was played for the first time in the 1992-1993 season. Already established as the most prestigious club tournament in football, Champions League has become even more popular with the introduction of a mini-league group stage system. The new concept had a resemblance to the FIFA World Cup with an early phase of group play followed by a knockout phase. On several occasions has the competition expanded to include more
[3] What distinguish the Champions League from European Cup is for many the group play instead of the round-robin format. The fact is, however, that a group stage was introduced already in 1991, but the reshaping became formalised by the name shift. In the development of the competition a hybrid-form of group play and round-robin has evolved.
[4] In the third edition of the Champions League (1994-1995), the tournament expanded to 16 teams (excluding the qualification). The format consisted of a group phase with four groups followed by three knockout stages.

In season 1997-1998 another expansion added more teams to 24 (excluding the qualification). A group phase, including six groups, was followed by a knockout phase in three stages.
[5] Format and participating teams
In the first edition (1992-1993), the tournament consisted of 8 teams after a qualification phase. The eight teams were playing in two groups followed by a final between the group winners. The first season included in total 36 participating clubs in the qualification, since when the numbers have increased.
[6] The tournaments have so far been dominated by the top European clubs and few surprise victories have occurred. Perhaps Porto's victory in 2004 should be counted as the biggest surprise. Potential sensations that could have happened was Nantes in 1995-96 that almost managed to go through Juventus in the semi-finals (lost 3-4 on aggregate). If Dynamo Kyiv had won in 1998-99 it would also be seen as a sensation; they were only one goal down on aggregation against Bayern Munich in the semi-finals."
"Until what year was the European Cup played?","['If the precessor, European Cup, is not counted the Champions League started in 1992. Although, when statistics are presented for Champions League it is common that Champions League and European League are accumulated.', 'What distinguish the Champions League from European Cup is for many the group play instead of the round-robin format. The fact is, however, that a group stage was introduced already in 1991, but the reshaping became formalised by the name shift. In the development of the competition a hybrid-form of group play and round-robin has evolved.', 'The UEFA Champions League came about as a new version of the European Cup and was played for the first time in the 1992-1993 season. Already established as the most prestigious club tournament in football, Champions League has become even more popular with the introduction of a mini-league group stage system. The new concept had a resemblance to the FIFA World Cup with an early phase of group play followed by a knockout phase. On several occasions has the competition expanded to include more', ""The tournaments have so far been dominated by the top European clubs and few surprise victories have occurred. Perhaps Porto's victory in 2004 should be counted as the biggest surprise. Potential sensations that could have happened was Nantes in 1995-96 that almost managed to go through Juventus in the semi-finals (lost 3-4 on aggregate). If Dynamo Kyiv had won in 1998-99 it would also be seen as a sensation; they were only one goal down on aggregation against Bayern Munich in the semi-finals."", 'Format and participating teams\nIn the first edition (1992-1993), the tournament consisted of 8 teams after a qualification phase. The eight teams were playing in two groups followed by a final between the group winners. The first season included in total 36 participating clubs in the qualification, since when the numbers have increased.', 'Records\nThe largest victory margin happened between HJK Helsinki and Bangor City in the second qualification round in 2011–12. If the qualification phase is excluded, the biggest goal difference is eight goals in the matches Liverpool-Besiktas (2007-2008) and Real Madrid-Malmö FF (2015-2016). If only finals are considered, the biggest win was in the 1994 final when Milan defeated Barcelona 4 to 0.']","The European Cup played from 1992 to 1993.","European Cup was played until 1992.","0.0","0.9601039977617853","0.9999999999666667","1.0","0.9354","
[1] If the precessor, European Cup, is not counted the Champions League started in 1992. Although, when statistics are presented for Champions League it is common that Champions League and European League are accumulated.
[2] What distinguish the Champions League from European Cup is for many the group play instead of the round-robin format. The fact is, however, that a group stage was introduced already in 1991, but the reshaping became formalised by the name shift. In the development of the competition a hybrid-form of group play and round-robin has evolved.
[3] The UEFA Champions League came about as a new version of the European Cup and was played for the first time in the 1992-1993 season. Already established as the most prestigious club tournament in football, Champions League has become even more popular with the introduction of a mini-league group stage system. The new concept had a resemblance to the FIFA World Cup with an early phase of group play followed by a knockout phase. On several occasions has the competition expanded to include more
[4] The tournaments have so far been dominated by the top European clubs and few surprise victories have occurred. Perhaps Porto's victory in 2004 should be counted as the biggest surprise. Potential sensations that could have happened was Nantes in 1995-96 that almost managed to go through Juventus in the semi-finals (lost 3-4 on aggregate). If Dynamo Kyiv had won in 1998-99 it would also be seen as a sensation; they were only one goal down on aggregation against Bayern Munich in the semi-finals.
[5] Format and participating teams
In the first edition (1992-1993), the tournament consisted of 8 teams after a qualification phase. The eight teams were playing in two groups followed by a final between the group winners. The first season included in total 36 participating clubs in the qualification, since when the numbers have increased.
[6] Records
The largest victory margin happened between HJK Helsinki and Bangor City in the second qualification round in 2011–12. If the qualification phase is excluded, the biggest goal difference is eight goals in the matches Liverpool-Besiktas (2007-2008) and Real Madrid-Malmö FF (2015-2016). If only finals are considered, the biggest win was in the 1994 final when Milan defeated Barcelona 4 to 0."
"Since when the Champions League started to be played?","['If the precessor, European Cup, is not counted the Champions League started in 1992. Although, when statistics are presented for Champions League it is common that Champions League and European League are accumulated.', 'The UEFA Champions League came about as a new version of the European Cup and was played for the first time in the 1992-1993 season. Already established as the most prestigious club tournament in football, Champions League has become even more popular with the introduction of a mini-league group stage system. The new concept had a resemblance to the FIFA World Cup with an early phase of group play followed by a knockout phase. On several occasions has the competition expanded to include more', 'What distinguish the Champions League from European Cup is for many the group play instead of the round-robin format. The fact is, however, that a group stage was introduced already in 1991, but the reshaping became formalised by the name shift. In the development of the competition a hybrid-form of group play and round-robin has evolved.', 'In the third edition of the Champions League (1994-1995), the tournament expanded to 16 teams (excluding the qualification). The format consisted of a group phase with four groups followed by three knockout stages.\n\nIn season 1997-1998 another expansion added more teams to 24 (excluding the qualification). A group phase, including six groups, was followed by a knockout phase in three stages.', 'followed by a knockout phase. On several occasions has the competition expanded to include more clubs – the initial 8 have become 32 (qualification stage excluded). The Champions League trophy can be kept permanently by a club that win the tournament five times or three times in a row (since the rule changed in 2008 it is only a replica). It is today almost as adored as the FIFA World Cup Trophy', 'Most times runners-up are Juventus (3), Milan (3), Bayern Munich (3) and Atlético Madrid (3). Manchester United, Valencia and Liverpool have also lost the final more than once.\n\nIf Champions League and European Cup titles are combined, Real Madrid is still the best performing club with 13 titles (6 and 7 in European Cup and Champions League respectively).']","The Champions League started in 1992-1993.","Champions League started to be played from 1992.","1.0","0.9668342425988298","0.99999999995","1.0","0.9438","
[1] If the precessor, European Cup, is not counted the Champions League started in 1992. Although, when statistics are presented for Champions League it is common that Champions League and European League are accumulated.
[2] The UEFA Champions League came about as a new version of the European Cup and was played for the first time in the 1992-1993 season. Already established as the most prestigious club tournament in football, Champions League has become even more popular with the introduction of a mini-league group stage system. The new concept had a resemblance to the FIFA World Cup with an early phase of group play followed by a knockout phase. On several occasions has the competition expanded to include more
[3] What distinguish the Champions League from European Cup is for many the group play instead of the round-robin format. The fact is, however, that a group stage was introduced already in 1991, but the reshaping became formalised by the name shift. In the development of the competition a hybrid-form of group play and round-robin has evolved.
[4] In the third edition of the Champions League (1994-1995), the tournament expanded to 16 teams (excluding the qualification). The format consisted of a group phase with four groups followed by three knockout stages.

In season 1997-1998 another expansion added more teams to 24 (excluding the qualification). A group phase, including six groups, was followed by a knockout phase in three stages.
[5] followed by a knockout phase. On several occasions has the competition expanded to include more clubs – the initial 8 have become 32 (qualification stage excluded). The Champions League trophy can be kept permanently by a club that win the tournament five times or three times in a row (since the rule changed in 2008 it is only a replica). It is today almost as adored as the FIFA World Cup Trophy
[6] Most times runners-up are Juventus (3), Milan (3), Bayern Munich (3) and Atlético Madrid (3). Manchester United, Valencia and Liverpool have also lost the final more than once.

If Champions League and European Cup titles are combined, Real Madrid is still the best performing club with 13 titles (6 and 7 in European Cup and Champions League respectively)."
"What is a difference between Champions League and European Cup?","['If the precessor, European Cup, is not counted the Champions League started in 1992. Although, when statistics are presented for Champions League it is common that Champions League and European League are accumulated.', 'The UEFA Champions League came about as a new version of the European Cup and was played for the first time in the 1992-1993 season. Already established as the most prestigious club tournament in football, Champions League has become even more popular with the introduction of a mini-league group stage system. The new concept had a resemblance to the FIFA World Cup with an early phase of group play followed by a knockout phase. On several occasions has the competition expanded to include more', 'What distinguish the Champions League from European Cup is for many the group play instead of the round-robin format. The fact is, however, that a group stage was introduced already in 1991, but the reshaping became formalised by the name shift. In the development of the competition a hybrid-form of group play and round-robin has evolved.', 'followed by a knockout phase. On several occasions has the competition expanded to include more clubs – the initial 8 have become 32 (qualification stage excluded). The Champions League trophy can be kept permanently by a club that win the tournament five times or three times in a row (since the rule changed in 2008 it is only a replica). It is today almost as adored as the FIFA World Cup Trophy', 'In the third edition of the Champions League (1994-1995), the tournament expanded to 16 teams (excluding the qualification). The format consisted of a group phase with four groups followed by three knockout stages.\n\nIn season 1997-1998 another expansion added more teams to 24 (excluding the qualification). A group phase, including six groups, was followed by a knockout phase in three stages.', 'Most times runners-up are Juventus (3), Milan (3), Bayern Munich (3) and Atlético Madrid (3). Manchester United, Valencia and Liverpool have also lost the final more than once.\n\nIf Champions League and European Cup titles are combined, Real Madrid is still the best performing club with 13 titles (6 and 7 in European Cup and Champions League respectively).']","The Champions League and European Cup are distinguished by the introduction of a group stage format, which is a key difference compared to the round-robin format used in the original European Cup. The Champions League has a group stage followed by a knockout phase, while the European Cup initially used a round-robin format, but was later reshaped with the introduction of a group stage.","Champions League has different format that European Cup.","1.0","0.9777040902430171","0.5833333333041666","0.0","0.7636","
[1] If the precessor, European Cup, is not counted the Champions League started in 1992. Although, when statistics are presented for Champions League it is common that Champions League and European League are accumulated.
[2] The UEFA Champions League came about as a new version of the European Cup and was played for the first time in the 1992-1993 season. Already established as the most prestigious club tournament in football, Champions League has become even more popular with the introduction of a mini-league group stage system. The new concept had a resemblance to the FIFA World Cup with an early phase of group play followed by a knockout phase. On several occasions has the competition expanded to include more
[3] What distinguish the Champions League from European Cup is for many the group play instead of the round-robin format. The fact is, however, that a group stage was introduced already in 1991, but the reshaping became formalised by the name shift. In the development of the competition a hybrid-form of group play and round-robin has evolved.
[4] followed by a knockout phase. On several occasions has the competition expanded to include more clubs – the initial 8 have become 32 (qualification stage excluded). The Champions League trophy can be kept permanently by a club that win the tournament five times or three times in a row (since the rule changed in 2008 it is only a replica). It is today almost as adored as the FIFA World Cup Trophy
[5] In the third edition of the Champions League (1994-1995), the tournament expanded to 16 teams (excluding the qualification). The format consisted of a group phase with four groups followed by three knockout stages.

In season 1997-1998 another expansion added more teams to 24 (excluding the qualification). A group phase, including six groups, was followed by a knockout phase in three stages.
[6] Most times runners-up are Juventus (3), Milan (3), Bayern Munich (3) and Atlético Madrid (3). Manchester United, Valencia and Liverpool have also lost the final more than once.

If Champions League and European Cup titles are combined, Real Madrid is still the best performing club with 13 titles (6 and 7 in European Cup and Champions League respectively)."
"Which club has the most wins in the Champions League?","['Most times runners-up are Juventus (3), Milan (3), Bayern Munich (3) and Atlético Madrid (3). Manchester United, Valencia and Liverpool have also lost the final more than once.\n\nIf Champions League and European Cup titles are combined, Real Madrid is still the best performing club with 13 titles (6 and 7 in European Cup and Champions League respectively).', 'If the precessor, European Cup, is not counted the Champions League started in 1992. Although, when statistics are presented for Champions League it is common that Champions League and European League are accumulated.', 'Records\nThe largest victory margin happened between HJK Helsinki and Bangor City in the second qualification round in 2011–12. If the qualification phase is excluded, the biggest goal difference is eight goals in the matches Liverpool-Besiktas (2007-2008) and Real Madrid-Malmö FF (2015-2016). If only finals are considered, the biggest win was in the 1994 final when Milan defeated Barcelona 4 to 0.', 'followed by a knockout phase. On several occasions has the competition expanded to include more clubs – the initial 8 have become 32 (qualification stage excluded). The Champions League trophy can be kept permanently by a club that win the tournament five times or three times in a row (since the rule changed in 2008 it is only a replica). It is today almost as adored as the FIFA World Cup Trophy', 'The UEFA Champions League came about as a new version of the European Cup and was played for the first time in the 1992-1993 season. Already established as the most prestigious club tournament in football, Champions League has become even more popular with the introduction of a mini-league group stage system. The new concept had a resemblance to the FIFA World Cup with an early phase of group play followed by a knockout phase. On several occasions has the competition expanded to include more', ""a sensation; they were only one goal down on aggregation against Bayern Munich in the semi-finals. Two years later, Leeds reached the semi-finals, but wasn't near to beat Valencia that time. Villa Real is another club that is not familiar to be seen at the final steps in the biggest events; they were only one goal down on aggregation against Arsenal in the semi-finals in 2006.""]","Real Madrid has the most wins in the Champions League.","Real Madrid has the most wins in the Champions League.","1.0","0.9843855956695213","0.9999999999","1.0","1.0","
[1] Most times runners-up are Juventus (3), Milan (3), Bayern Munich (3) and Atlético Madrid (3). Manchester United, Valencia and Liverpool have also lost the final more than once.

If Champions League and European Cup titles are combined, Real Madrid is still the best performing club with 13 titles (6 and 7 in European Cup and Champions League respectively).
[2] If the precessor, European Cup, is not counted the Champions League started in 1992. Although, when statistics are presented for Champions League it is common that Champions League and European League are accumulated.
[3] Records
The largest victory margin happened between HJK Helsinki and Bangor City in the second qualification round in 2011–12. If the qualification phase is excluded, the biggest goal difference is eight goals in the matches Liverpool-Besiktas (2007-2008) and Real Madrid-Malmö FF (2015-2016). If only finals are considered, the biggest win was in the 1994 final when Milan defeated Barcelona 4 to 0.
[4] followed by a knockout phase. On several occasions has the competition expanded to include more clubs – the initial 8 have become 32 (qualification stage excluded). The Champions League trophy can be kept permanently by a club that win the tournament five times or three times in a row (since the rule changed in 2008 it is only a replica). It is today almost as adored as the FIFA World Cup Trophy
[5] The UEFA Champions League came about as a new version of the European Cup and was played for the first time in the 1992-1993 season. Already established as the most prestigious club tournament in football, Champions League has become even more popular with the introduction of a mini-league group stage system. The new concept had a resemblance to the FIFA World Cup with an early phase of group play followed by a knockout phase. On several occasions has the competition expanded to include more
[6] a sensation; they were only one goal down on aggregation against Bayern Munich in the semi-finals. Two years later, Leeds reached the semi-finals, but wasn't near to beat Valencia that time. Villa Real is another club that is not familiar to be seen at the final steps in the biggest events; they were only one goal down on aggregation against Arsenal in the semi-finals in 2006."
"How many times Real Madrid won European Cup?","['Most times runners-up are Juventus (3), Milan (3), Bayern Munich (3) and Atlético Madrid (3). Manchester United, Valencia and Liverpool have also lost the final more than once.\n\nIf Champions League and European Cup titles are combined, Real Madrid is still the best performing club with 13 titles (6 and 7 in European Cup and Champions League respectively).', 'If the precessor, European Cup, is not counted the Champions League started in 1992. Although, when statistics are presented for Champions League it is common that Champions League and European League are accumulated.', ""a sensation; they were only one goal down on aggregation against Bayern Munich in the semi-finals. Two years later, Leeds reached the semi-finals, but wasn't near to beat Valencia that time. Villa Real is another club that is not familiar to be seen at the final steps in the biggest events; they were only one goal down on aggregation against Arsenal in the semi-finals in 2006."", ""The tournaments have so far been dominated by the top European clubs and few surprise victories have occurred. Perhaps Porto's victory in 2004 should be counted as the biggest surprise. Potential sensations that could have happened was Nantes in 1995-96 that almost managed to go through Juventus in the semi-finals (lost 3-4 on aggregate). If Dynamo Kyiv had won in 1998-99 it would also be seen as a sensation; they were only one goal down on aggregation against Bayern Munich in the semi-finals."", 'Records\nThe largest victory margin happened between HJK Helsinki and Bangor City in the second qualification round in 2011–12. If the qualification phase is excluded, the biggest goal difference is eight goals in the matches Liverpool-Besiktas (2007-2008) and Real Madrid-Malmö FF (2015-2016). If only finals are considered, the biggest win was in the 1994 final when Milan defeated Barcelona 4 to 0.', 'followed by a knockout phase. On several occasions has the competition expanded to include more clubs – the initial 8 have become 32 (qualification stage excluded). The Champions League trophy can be kept permanently by a club that win the tournament five times or three times in a row (since the rule changed in 2008 it is only a replica). It is today almost as adored as the FIFA World Cup Trophy']","13 times","Real Madrid won European Cup 6 times.","1.0","0.8343085774226995","0.9999999999","1.0","0.3563","
[1] Most times runners-up are Juventus (3), Milan (3), Bayern Munich (3) and Atlético Madrid (3). Manchester United, Valencia and Liverpool have also lost the final more than once.

If Champions League and European Cup titles are combined, Real Madrid is still the best performing club with 13 titles (6 and 7 in European Cup and Champions League respectively).
[2] If the precessor, European Cup, is not counted the Champions League started in 1992. Although, when statistics are presented for Champions League it is common that Champions League and European League are accumulated.
[3] a sensation; they were only one goal down on aggregation against Bayern Munich in the semi-finals. Two years later, Leeds reached the semi-finals, but wasn't near to beat Valencia that time. Villa Real is another club that is not familiar to be seen at the final steps in the biggest events; they were only one goal down on aggregation against Arsenal in the semi-finals in 2006.
[4] The tournaments have so far been dominated by the top European clubs and few surprise victories have occurred. Perhaps Porto's victory in 2004 should be counted as the biggest surprise. Potential sensations that could have happened was Nantes in 1995-96 that almost managed to go through Juventus in the semi-finals (lost 3-4 on aggregate). If Dynamo Kyiv had won in 1998-99 it would also be seen as a sensation; they were only one goal down on aggregation against Bayern Munich in the semi-finals.
[5] Records
The largest victory margin happened between HJK Helsinki and Bangor City in the second qualification round in 2011–12. If the qualification phase is excluded, the biggest goal difference is eight goals in the matches Liverpool-Besiktas (2007-2008) and Real Madrid-Malmö FF (2015-2016). If only finals are considered, the biggest win was in the 1994 final when Milan defeated Barcelona 4 to 0.
[6] followed by a knockout phase. On several occasions has the competition expanded to include more clubs – the initial 8 have become 32 (qualification stage excluded). The Champions League trophy can be kept permanently by a club that win the tournament five times or three times in a row (since the rule changed in 2008 it is only a replica). It is today almost as adored as the FIFA World Cup Trophy"
"How many years after first edition of Champions League tournament was extended to 16 teams?","['In the third edition of the Champions League (1994-1995), the tournament expanded to 16 teams (excluding the qualification). The format consisted of a group phase with four groups followed by three knockout stages.\n\nIn season 1997-1998 another expansion added more teams to 24 (excluding the qualification). A group phase, including six groups, was followed by a knockout phase in three stages.', 'Format and participating teams\nIn the first edition (1992-1993), the tournament consisted of 8 teams after a qualification phase. The eight teams were playing in two groups followed by a final between the group winners. The first season included in total 36 participating clubs in the qualification, since when the numbers have increased.', 'If the precessor, European Cup, is not counted the Champions League started in 1992. Although, when statistics are presented for Champions League it is common that Champions League and European League are accumulated.', 'The UEFA Champions League came about as a new version of the European Cup and was played for the first time in the 1992-1993 season. Already established as the most prestigious club tournament in football, Champions League has become even more popular with the introduction of a mini-league group stage system. The new concept had a resemblance to the FIFA World Cup with an early phase of group play followed by a knockout phase. On several occasions has the competition expanded to include more', 'followed by a knockout phase. On several occasions has the competition expanded to include more clubs – the initial 8 have become 32 (qualification stage excluded). The Champions League trophy can be kept permanently by a club that win the tournament five times or three times in a row (since the rule changed in 2008 it is only a replica). It is today almost as adored as the FIFA World Cup Trophy', 'What distinguish the Champions League from European Cup is for many the group play instead of the round-robin format. The fact is, however, that a group stage was introduced already in 1991, but the reshaping became formalised by the name shift. In the development of the competition a hybrid-form of group play and round-robin has evolved.']","The Champions League was extended to 16 teams in 1992.","Champions League was extended to 16 teams after 2 years.","0.5","0.9717459815975414","0.9999999999","0.0","0.8625","
[1] In the third edition of the Champions League (1994-1995), the tournament expanded to 16 teams (excluding the qualification). The format consisted of a group phase with four groups followed by three knockout stages.

In season 1997-1998 another expansion added more teams to 24 (excluding the qualification). A group phase, including six groups, was followed by a knockout phase in three stages.
[2] Format and participating teams
In the first edition (1992-1993), the tournament consisted of 8 teams after a qualification phase. The eight teams were playing in two groups followed by a final between the group winners. The first season included in total 36 participating clubs in the qualification, since when the numbers have increased.
[3] If the precessor, European Cup, is not counted the Champions League started in 1992. Although, when statistics are presented for Champions League it is common that Champions League and European League are accumulated.
[4] The UEFA Champions League came about as a new version of the European Cup and was played for the first time in the 1992-1993 season. Already established as the most prestigious club tournament in football, Champions League has become even more popular with the introduction of a mini-league group stage system. The new concept had a resemblance to the FIFA World Cup with an early phase of group play followed by a knockout phase. On several occasions has the competition expanded to include more
[5] followed by a knockout phase. On several occasions has the competition expanded to include more clubs – the initial 8 have become 32 (qualification stage excluded). The Champions League trophy can be kept permanently by a club that win the tournament five times or three times in a row (since the rule changed in 2008 it is only a replica). It is today almost as adored as the FIFA World Cup Trophy
[6] What distinguish the Champions League from European Cup is for many the group play instead of the round-robin format. The fact is, however, that a group stage was introduced already in 1991, but the reshaping became formalised by the name shift. In the development of the competition a hybrid-form of group play and round-robin has evolved."
"How many teams participated in the first edition of the Champions League?","['In the third edition of the Champions League (1994-1995), the tournament expanded to 16 teams (excluding the qualification). The format consisted of a group phase with four groups followed by three knockout stages.\n\nIn season 1997-1998 another expansion added more teams to 24 (excluding the qualification). A group phase, including six groups, was followed by a knockout phase in three stages.', 'Format and participating teams\nIn the first edition (1992-1993), the tournament consisted of 8 teams after a qualification phase. The eight teams were playing in two groups followed by a final between the group winners. The first season included in total 36 participating clubs in the qualification, since when the numbers have increased.', 'If the precessor, European Cup, is not counted the Champions League started in 1992. Although, when statistics are presented for Champions League it is common that Champions League and European League are accumulated.', 'The UEFA Champions League came about as a new version of the European Cup and was played for the first time in the 1992-1993 season. Already established as the most prestigious club tournament in football, Champions League has become even more popular with the introduction of a mini-league group stage system. The new concept had a resemblance to the FIFA World Cup with an early phase of group play followed by a knockout phase. On several occasions has the competition expanded to include more', 'What distinguish the Champions League from European Cup is for many the group play instead of the round-robin format. The fact is, however, that a group stage was introduced already in 1991, but the reshaping became formalised by the name shift. In the development of the competition a hybrid-form of group play and round-robin has evolved.', 'followed by a knockout phase. On several occasions has the competition expanded to include more clubs – the initial 8 have become 32 (qualification stage excluded). The Champions League trophy can be kept permanently by a club that win the tournament five times or three times in a row (since the rule changed in 2008 it is only a replica). It is today almost as adored as the FIFA World Cup Trophy']","The first edition of the Champions League consisted of 8 teams.
","In the first edition of the Champions League 8 teams were playing.","1.0","0.9900380840409556","0.4166666666458333","1.0","0.8759","
[1] In the third edition of the Champions League (1994-1995), the tournament expanded to 16 teams (excluding the qualification). The format consisted of a group phase with four groups followed by three knockout stages.

In season 1997-1998 another expansion added more teams to 24 (excluding the qualification). A group phase, including six groups, was followed by a knockout phase in three stages.
[2] Format and participating teams
In the first edition (1992-1993), the tournament consisted of 8 teams after a qualification phase. The eight teams were playing in two groups followed by a final between the group winners. The first season included in total 36 participating clubs in the qualification, since when the numbers have increased.
[3] If the precessor, European Cup, is not counted the Champions League started in 1992. Although, when statistics are presented for Champions League it is common that Champions League and European League are accumulated.
[4] The UEFA Champions League came about as a new version of the European Cup and was played for the first time in the 1992-1993 season. Already established as the most prestigious club tournament in football, Champions League has become even more popular with the introduction of a mini-league group stage system. The new concept had a resemblance to the FIFA World Cup with an early phase of group play followed by a knockout phase. On several occasions has the competition expanded to include more
[5] What distinguish the Champions League from European Cup is for many the group play instead of the round-robin format. The fact is, however, that a group stage was introduced already in 1991, but the reshaping became formalised by the name shift. In the development of the competition a hybrid-form of group play and round-robin has evolved.
[6] followed by a knockout phase. On several occasions has the competition expanded to include more clubs – the initial 8 have become 32 (qualification stage excluded). The Champions League trophy can be kept permanently by a club that win the tournament five times or three times in a row (since the rule changed in 2008 it is only a replica). It is today almost as adored as the FIFA World Cup Trophy"
