user_input,retrieved_contexts,response,reference,faithfulness,answer_relevancy,context_precision,context_recall
You are a football analyst. Answer the question truthfully and precisely: Who is owner of Lyon?,"['Last October, his Eagle Football Group, which owns a 77% stake in Lyon, announced debts of £422m.\nIn a statement, Lyon said the DNGC\'s decision was ""incomprehensible"" and confirmed they would appeal.\nLyon\'s relegation could prove significant to Crystal Palace\'s hopes of playing in the Europa League next season.\nTheir participation is currently in doubt because of Uefa rules, which prevent multiple teams under one multi-club ownership structure competing in the same European competition.', 'French club Lyon have been demoted to Ligue 2 because of the poor state of their finances.\nThe club were provisionally demoted by the DNGC, the body which oversees the accounts of French professional football clubs, in November.\nLyon officials including owner John Textor, met with the DNGC on Tuesday but failed to convince the body that the club had sufficiently improved their financial situation to lift the punishment.', 'Textor owns stakes in both clubs although he agreed a deal to sell his 43% share in Palace on Monday.']","John Textor.
",John Textor is the owner of Lyon.,0.0,0.7690320574996918,0.49999999995,1.0
You are a football analyst. Answer the question truthfully and precisely: Which club has hope to play in the Europa League next season?,"['Last October, his Eagle Football Group, which owns a 77% stake in Lyon, announced debts of £422m.\nIn a statement, Lyon said the DNGC\'s decision was ""incomprehensible"" and confirmed they would appeal.\nLyon\'s relegation could prove significant to Crystal Palace\'s hopes of playing in the Europa League next season.\nTheir participation is currently in doubt because of Uefa rules, which prevent multiple teams under one multi-club ownership structure competing in the same European competition.', 'French club Lyon have been demoted to Ligue 2 because of the poor state of their finances.\nThe club were provisionally demoted by the DNGC, the body which oversees the accounts of French professional football clubs, in November.\nLyon officials including owner John Textor, met with the DNGC on Tuesday but failed to convince the body that the club had sufficiently improved their financial situation to lift the punishment.', 'Textor owns stakes in both clubs although he agreed a deal to sell his 43% share in Palace on Monday.']","Crystal Palace.

Reason: The context states that Lyon’s relegation could prove significant to Crystal Palace’s hopes of playing in the Europa League next season.",Cristal Palace has hope to play in the Europa League next season.,1.0,0.7983127867034256,0.9999999999,1.0
You are a football analyst. Answer the question truthfully and precisely: Why Lyon has been relegated?,"['French club Lyon have been demoted to Ligue 2 because of the poor state of their finances.\nThe club were provisionally demoted by the DNGC, the body which oversees the accounts of French professional football clubs, in November.\nLyon officials including owner John Textor, met with the DNGC on Tuesday but failed to convince the body that the club had sufficiently improved their financial situation to lift the punishment.', 'Last October, his Eagle Football Group, which owns a 77% stake in Lyon, announced debts of £422m.\nIn a statement, Lyon said the DNGC\'s decision was ""incomprehensible"" and confirmed they would appeal.\nLyon\'s relegation could prove significant to Crystal Palace\'s hopes of playing in the Europa League next season.\nTheir participation is currently in doubt because of Uefa rules, which prevent multiple teams under one multi-club ownership structure competing in the same European competition.', 'Textor owns stakes in both clubs although he agreed a deal to sell his 43% share in Palace on Monday.']","Lyon has been relegated due to poor financial state. The DNGC (body overseeing French football clubs) provisionally demoted them in November after failing to convince them to improve their financial situation to lift the punishment. Their debts, which reached £422m last October, are a significant factor contributing to this relegation.",Lyon has not been relegated; the question is based on a false assumption.,0.7142857142857143,0.9120521612000715,0.49999999995,0.0
You are a football analyst. Answer the question truthfully and precisely: Which quarter of a year Eagle Football Group announced debts of £422m?,"['Last October, his Eagle Football Group, which owns a 77% stake in Lyon, announced debts of £422m.\nIn a statement, Lyon said the DNGC\'s decision was ""incomprehensible"" and confirmed they would appeal.\nLyon\'s relegation could prove significant to Crystal Palace\'s hopes of playing in the Europa League next season.\nTheir participation is currently in doubt because of Uefa rules, which prevent multiple teams under one multi-club ownership structure competing in the same European competition.', 'Textor owns stakes in both clubs although he agreed a deal to sell his 43% share in Palace on Monday.', 'French club Lyon have been demoted to Ligue 2 because of the poor state of their finances.\nThe club were provisionally demoted by the DNGC, the body which oversees the accounts of French professional football clubs, in November.\nLyon officials including owner John Textor, met with the DNGC on Tuesday but failed to convince the body that the club had sufficiently improved their financial situation to lift the punishment.']",October.,On fourth quarter of a year Eagle Football Group announced debts of £422m.,1.0,0.7541731675278278,0.9999999999,1.0
