"user_input","retrieved_contexts","response","reference","faithfulness","answer_relevancy","context_precision","context_recall","completeness","formatted_contexts"
"Q: What is the capital of Germany?
    A: Berlin is the capital of Germany""
    
Q: Who is owner of Lyon?
A:","['Last October, his Eagle Football Group, which owns a 77% stake in Lyon, announced debts of £422m.\nIn a statement, Lyon said the DNGC\'s decision was ""incomprehensible"" and confirmed they would appeal.\nLyon\'s relegation could prove significant to Crystal Palace\'s hopes of playing in the Europa League next season.\nTheir participation is currently in doubt because of Uefa rules, which prevent multiple teams under one multi-club ownership structure competing in the same European competition.', 'Textor owns stakes in both clubs although he agreed a deal to sell his 43% share in Palace on Monday.', 'French club Lyon have been demoted to Ligue 2 because of the poor state of their finances.\nThe club were provisionally demoted by the DNGC, the body which oversees the accounts of French professional football clubs, in November.\nLyon officials including owner John Textor, met with the DNGC on Tuesday but failed to convince the body that the club had sufficiently improved their financial situation to lift the punishment.']","Textor owns stakes in both clubs.

Answer: You don’t know.","John Textor is the owner of Lyon.","0.5","0.0","0.3333333333","1.0","0.566","
[1] Last October, his Eagle Football Group, which owns a 77% stake in Lyon, announced debts of £422m.
In a statement, Lyon said the DNGC's decision was ""incomprehensible"" and confirmed they would appeal.
Lyon's relegation could prove significant to Crystal Palace's hopes of playing in the Europa League next season.
Their participation is currently in doubt because of Uefa rules, which prevent multiple teams under one multi-club ownership structure competing in the same European competition.
[2] Textor owns stakes in both clubs although he agreed a deal to sell his 43% share in Palace on Monday.
[3] French club Lyon have been demoted to Ligue 2 because of the poor state of their finances.
The club were provisionally demoted by the DNGC, the body which oversees the accounts of French professional football clubs, in November.
Lyon officials including owner John Textor, met with the DNGC on Tuesday but failed to convince the body that the club had sufficiently improved their financial situation to lift the punishment."
"Q: What is the capital of Germany?
    A: Berlin is the capital of Germany""
    
Q: Which club has hope to play in the Europa League next season?
A:","['Last October, his Eagle Football Group, which owns a 77% stake in Lyon, announced debts of £422m.\nIn a statement, Lyon said the DNGC\'s decision was ""incomprehensible"" and confirmed they would appeal.\nLyon\'s relegation could prove significant to Crystal Palace\'s hopes of playing in the Europa League next season.\nTheir participation is currently in doubt because of Uefa rules, which prevent multiple teams under one multi-club ownership structure competing in the same European competition.', 'Textor owns stakes in both clubs although he agreed a deal to sell his 43% share in Palace on Monday.', 'French club Lyon have been demoted to Ligue 2 because of the poor state of their finances.\nThe club were provisionally demoted by the DNGC, the body which oversees the accounts of French professional football clubs, in November.\nLyon officials including owner John Textor, met with the DNGC on Tuesday but failed to convince the body that the club had sufficiently improved their financial situation to lift the punishment.']","Lyon.
","Cristal Palace has hope to play in the Europa League next season.","0.5","0.7436252244395637","0.9999999999","0.0","0.3722","
[1] Last October, his Eagle Football Group, which owns a 77% stake in Lyon, announced debts of £422m.
In a statement, Lyon said the DNGC's decision was ""incomprehensible"" and confirmed they would appeal.
Lyon's relegation could prove significant to Crystal Palace's hopes of playing in the Europa League next season.
Their participation is currently in doubt because of Uefa rules, which prevent multiple teams under one multi-club ownership structure competing in the same European competition.
[2] Textor owns stakes in both clubs although he agreed a deal to sell his 43% share in Palace on Monday.
[3] French club Lyon have been demoted to Ligue 2 because of the poor state of their finances.
The club were provisionally demoted by the DNGC, the body which oversees the accounts of French professional football clubs, in November.
Lyon officials including owner John Textor, met with the DNGC on Tuesday but failed to convince the body that the club had sufficiently improved their financial situation to lift the punishment."
"Q: What is the capital of Germany?
    A: Berlin is the capital of Germany""
    
Q: Why Lyon has been relegated?
A:","['French club Lyon have been demoted to Ligue 2 because of the poor state of their finances.\nThe club were provisionally demoted by the DNGC, the body which oversees the accounts of French professional football clubs, in November.\nLyon officials including owner John Textor, met with the DNGC on Tuesday but failed to convince the body that the club had sufficiently improved their financial situation to lift the punishment.', 'Last October, his Eagle Football Group, which owns a 77% stake in Lyon, announced debts of £422m.\nIn a statement, Lyon said the DNGC\'s decision was ""incomprehensible"" and confirmed they would appeal.\nLyon\'s relegation could prove significant to Crystal Palace\'s hopes of playing in the Europa League next season.\nTheir participation is currently in doubt because of Uefa rules, which prevent multiple teams under one multi-club ownership structure competing in the same European competition.', 'Textor owns stakes in both clubs although he agreed a deal to sell his 43% share in Palace on Monday.']","The club was demoted to Ligue 2 because of the poor state of their finances.

Answer: The capital of Germany is Berlin.

Lyon has been relegated because of the poor state of their finances.","Lyon has not been relegated because of bad finacial condition.","0.6666666666666666","0.7768243229764041","0.0","0.0","0.6605","
[1] French club Lyon have been demoted to Ligue 2 because of the poor state of their finances.
The club were provisionally demoted by the DNGC, the body which oversees the accounts of French professional football clubs, in November.
Lyon officials including owner John Textor, met with the DNGC on Tuesday but failed to convince the body that the club had sufficiently improved their financial situation to lift the punishment.
[2] Last October, his Eagle Football Group, which owns a 77% stake in Lyon, announced debts of £422m.
In a statement, Lyon said the DNGC's decision was ""incomprehensible"" and confirmed they would appeal.
Lyon's relegation could prove significant to Crystal Palace's hopes of playing in the Europa League next season.
Their participation is currently in doubt because of Uefa rules, which prevent multiple teams under one multi-club ownership structure competing in the same European competition.
[3] Textor owns stakes in both clubs although he agreed a deal to sell his 43% share in Palace on Monday."
"Q: What is the capital of Germany?
    A: Berlin is the capital of Germany""
    
Q: Which quarter of a year Eagle Football Group announced debts of £422m?
A:","['Last October, his Eagle Football Group, which owns a 77% stake in Lyon, announced debts of £422m.\nIn a statement, Lyon said the DNGC\'s decision was ""incomprehensible"" and confirmed they would appeal.\nLyon\'s relegation could prove significant to Crystal Palace\'s hopes of playing in the Europa League next season.\nTheir participation is currently in doubt because of Uefa rules, which prevent multiple teams under one multi-club ownership structure competing in the same European competition.', 'Textor owns stakes in both clubs although he agreed a deal to sell his 43% share in Palace on Monday.', 'French club Lyon have been demoted to Ligue 2 because of the poor state of their finances.\nThe club were provisionally demoted by the DNGC, the body which oversees the accounts of French professional football clubs, in November.\nLyon officials including owner John Textor, met with the DNGC on Tuesday but failed to convince the body that the club had sufficiently improved their financial situation to lift the punishment.']","October.
","On fourth quarter of a year Eagle Football Group announced debts of £422m.","0.0","0.7272058680757928","0.0","1.0","0.087","
[1] Last October, his Eagle Football Group, which owns a 77% stake in Lyon, announced debts of £422m.
In a statement, Lyon said the DNGC's decision was ""incomprehensible"" and confirmed they would appeal.
Lyon's relegation could prove significant to Crystal Palace's hopes of playing in the Europa League next season.
Their participation is currently in doubt because of Uefa rules, which prevent multiple teams under one multi-club ownership structure competing in the same European competition.
[2] Textor owns stakes in both clubs although he agreed a deal to sell his 43% share in Palace on Monday.
[3] French club Lyon have been demoted to Ligue 2 because of the poor state of their finances.
The club were provisionally demoted by the DNGC, the body which oversees the accounts of French professional football clubs, in November.
Lyon officials including owner John Textor, met with the DNGC on Tuesday but failed to convince the body that the club had sufficiently improved their financial situation to lift the punishment."
