user_input,retrieved_contexts,response,reference,faithfulness,answer_relevancy,context_precision,context_recall
You are a football analyst. Answer the question truthfully and precisely: Who is owner of Lyon?,"['Last October, his Eagle Football Group, which owns a 77% stake in Lyon, announced debts of £422m.\nIn a statement, Lyon said the DNGC\'s decision was ""incomprehensible"" and confirmed they would appeal.\nLyon\'s relegation could prove significant to Crystal Palace\'s hopes of playing in the Europa League next season.\nTheir participation is currently in doubt because of Uefa rules, which prevent multiple teams under one multi-club ownership structure competing in the same European competition.', 'French club Lyon have been demoted to Ligue 2 because of the poor state of their finances.\nThe club were provisionally demoted by the DNGC, the body which oversees the accounts of French professional football clubs, in November.\nLyon officials including owner John Textor, met with the DNGC on Tuesday but failed to convince the body that the club had sufficiently improved their financial situation to lift the punishment.', 'Textor owns stakes in both clubs although he agreed a deal to sell his 43% share in Palace on Monday.']","John Textor.
",John Textor is the owner of Lyon.,0.0,0.772550526694359,0.49999999995,1.0
You are a football analyst. Answer the question truthfully and precisely: Which club has hope to play in the Europa League next season?,"['Last October, his Eagle Football Group, which owns a 77% stake in Lyon, announced debts of £422m.\nIn a statement, Lyon said the DNGC\'s decision was ""incomprehensible"" and confirmed they would appeal.\nLyon\'s relegation could prove significant to Crystal Palace\'s hopes of playing in the Europa League next season.\nTheir participation is currently in doubt because of Uefa rules, which prevent multiple teams under one multi-club ownership structure competing in the same European competition.', 'French club Lyon have been demoted to Ligue 2 because of the poor state of their finances.\nThe club were provisionally demoted by the DNGC, the body which oversees the accounts of French professional football clubs, in November.\nLyon officials including owner John Textor, met with the DNGC on Tuesday but failed to convince the body that the club had sufficiently improved their financial situation to lift the punishment.', 'Textor owns stakes in both clubs although he agreed a deal to sell his 43% share in Palace on Monday.']","Crystal Palace.

Reason: The context states that Lyon’s relegation could prove significant to Crystal Palace’s hopes of playing in the Europa League next season.
",Cristal Palace has hope to play in the Europa League next season.,1.0,0.8143086063019603,0.9999999999,1.0
You are a football analyst. Answer the question truthfully and precisely: Why Lyon has been relegated?,"['French club Lyon have been demoted to Ligue 2 because of the poor state of their finances.\nThe club were provisionally demoted by the DNGC, the body which oversees the accounts of French professional football clubs, in November.\nLyon officials including owner John Textor, met with the DNGC on Tuesday but failed to convince the body that the club had sufficiently improved their financial situation to lift the punishment.', 'Last October, his Eagle Football Group, which owns a 77% stake in Lyon, announced debts of £422m.\nIn a statement, Lyon said the DNGC\'s decision was ""incomprehensible"" and confirmed they would appeal.\nLyon\'s relegation could prove significant to Crystal Palace\'s hopes of playing in the Europa League next season.\nTheir participation is currently in doubt because of Uefa rules, which prevent multiple teams under one multi-club ownership structure competing in the same European competition.', 'Textor owns stakes in both clubs although he agreed a deal to sell his 43% share in Palace on Monday.']","Lyon has been relegated due to poor financial conditions as a result of the DNGC’s temporary demotion and the club’s substantial debt, which includes £422 million. This debt, coupled with the DNGC’s decision to deem the club’s financial situation inadequate for a return to Ligue 1, led to the relegation.",Lyon has not been relegated because of bad finacial condition.,0.8,0.9032503712806902,0.0,0.0
You are a football analyst. Answer the question truthfully and precisely: Which quarter of a year Eagle Football Group announced debts of £422m?,"['Last October, his Eagle Football Group, which owns a 77% stake in Lyon, announced debts of £422m.\nIn a statement, Lyon said the DNGC\'s decision was ""incomprehensible"" and confirmed they would appeal.\nLyon\'s relegation could prove significant to Crystal Palace\'s hopes of playing in the Europa League next season.\nTheir participation is currently in doubt because of Uefa rules, which prevent multiple teams under one multi-club ownership structure competing in the same European competition.', 'Textor owns stakes in both clubs although he agreed a deal to sell his 43% share in Palace on Monday.', 'French club Lyon have been demoted to Ligue 2 because of the poor state of their finances.\nThe club were provisionally demoted by the DNGC, the body which oversees the accounts of French professional football clubs, in November.\nLyon officials including owner John Textor, met with the DNGC on Tuesday but failed to convince the body that the club had sufficiently improved their financial situation to lift the punishment.']",Last October.,On fourth quarter of a year Eagle Football Group announced debts of £422m.,0.5,0.7632681500377471,0.9999999999,1.0
