"user_input","retrieved_contexts","response","reference","faithfulness","answer_relevancy","context_precision","context_recall","formatted_contexts"
"Who is owner of Lyon?","['Last October, his Eagle Football Group, which owns a 77% stake in Lyon, announced debts of £422m.\nIn a statement, Lyon said the DNGC\'s decision was ""incomprehensible"" and confirmed they would appeal.\nLyon\'s relegation could prove significant to Crystal Palace\'s hopes of playing in the Europa League next season.\nTheir participation is currently in doubt because of Uefa rules, which prevent multiple teams under one multi-club ownership structure competing in the same European competition.', 'French club Lyon have been demoted to Ligue 2 because of the poor state of their finances.\nThe club were provisionally demoted by the DNGC, the body which oversees the accounts of French professional football clubs, in November.\nLyon officials including owner John Textor, met with the DNGC on Tuesday but failed to convince the body that the club had sufficiently improved their financial situation to lift the punishment.', 'Textor owns stakes in both clubs although he agreed a deal to sell his 43% share in Palace on Monday.']","John Textor.","John Textor is the owner of Lyon.","0.0","0.7608702971200824","0.49999999995","1.0","[1] Last October, his Eagle Football Group, which owns a 77% stake in Lyon, announced debts of £422m.
In a statement, Lyon said the DNGC's decision was ""incomprehensible"" and confirmed they would appeal.
Lyon's relegation could prove significant to Crystal Palace's hopes of playing in the Europa League next season.
Their participation is currently in doubt because of Uefa rules, which prevent multiple teams under one multi-club ownership structure competing in the same European competition.
[2] French club Lyon have been demoted to Ligue 2 because of the poor state of their finances.
The club were provisionally demoted by the DNGC, the body which oversees the accounts of French professional football clubs, in November.
Lyon officials including owner John Textor, met with the DNGC on Tuesday but failed to convince the body that the club had sufficiently improved their financial situation to lift the punishment.
[3] Textor owns stakes in both clubs although he agreed a deal to sell his 43% share in Palace on Monday."
"Which club has hope to play in the Europa League next season?","['Last October, his Eagle Football Group, which owns a 77% stake in Lyon, announced debts of £422m.\nIn a statement, Lyon said the DNGC\'s decision was ""incomprehensible"" and confirmed they would appeal.\nLyon\'s relegation could prove significant to Crystal Palace\'s hopes of playing in the Europa League next season.\nTheir participation is currently in doubt because of Uefa rules, which prevent multiple teams under one multi-club ownership structure competing in the same European competition.', 'French club Lyon have been demoted to Ligue 2 because of the poor state of their finances.\nThe club were provisionally demoted by the DNGC, the body which oversees the accounts of French professional football clubs, in November.\nLyon officials including owner John Textor, met with the DNGC on Tuesday but failed to convince the body that the club had sufficiently improved their financial situation to lift the punishment.', 'Textor owns stakes in both clubs although he agreed a deal to sell his 43% share in Palace on Monday.']","Crystal Palace.","Cristal Palace has hope to play in the Europa League next season.","1.0","0.8203776009668419","0.9999999999","1.0","[1] Last October, his Eagle Football Group, which owns a 77% stake in Lyon, announced debts of £422m.
In a statement, Lyon said the DNGC's decision was ""incomprehensible"" and confirmed they would appeal.
Lyon's relegation could prove significant to Crystal Palace's hopes of playing in the Europa League next season.
Their participation is currently in doubt because of Uefa rules, which prevent multiple teams under one multi-club ownership structure competing in the same European competition.
[2] French club Lyon have been demoted to Ligue 2 because of the poor state of their finances.
The club were provisionally demoted by the DNGC, the body which oversees the accounts of French professional football clubs, in November.
Lyon officials including owner John Textor, met with the DNGC on Tuesday but failed to convince the body that the club had sufficiently improved their financial situation to lift the punishment.
[3] Textor owns stakes in both clubs although he agreed a deal to sell his 43% share in Palace on Monday."
"Why Lyon has been relegated?","['French club Lyon have been demoted to Ligue 2 because of the poor state of their finances.\nThe club were provisionally demoted by the DNGC, the body which oversees the accounts of French professional football clubs, in November.\nLyon officials including owner John Textor, met with the DNGC on Tuesday but failed to convince the body that the club had sufficiently improved their financial situation to lift the punishment.', 'Last October, his Eagle Football Group, which owns a 77% stake in Lyon, announced debts of £422m.\nIn a statement, Lyon said the DNGC\'s decision was ""incomprehensible"" and confirmed they would appeal.\nLyon\'s relegation could prove significant to Crystal Palace\'s hopes of playing in the Europa League next season.\nTheir participation is currently in doubt because of Uefa rules, which prevent multiple teams under one multi-club ownership structure competing in the same European competition.', 'Textor owns stakes in both clubs although he agreed a deal to sell his 43% share in Palace on Monday.']","Lyon has been relegated because of their poor state of finances, as evidenced by their provisional demotion by the DNGC and the substantial debts they incurred last October.
","Lyon has not been relegated because of bad finacial condition.","1.0","0.9910148769873853","0.0","0.0","[1] French club Lyon have been demoted to Ligue 2 because of the poor state of their finances.
The club were provisionally demoted by the DNGC, the body which oversees the accounts of French professional football clubs, in November.
Lyon officials including owner John Textor, met with the DNGC on Tuesday but failed to convince the body that the club had sufficiently improved their financial situation to lift the punishment.
[2] Last October, his Eagle Football Group, which owns a 77% stake in Lyon, announced debts of £422m.
In a statement, Lyon said the DNGC's decision was ""incomprehensible"" and confirmed they would appeal.
Lyon's relegation could prove significant to Crystal Palace's hopes of playing in the Europa League next season.
Their participation is currently in doubt because of Uefa rules, which prevent multiple teams under one multi-club ownership structure competing in the same European competition.
[3] Textor owns stakes in both clubs although he agreed a deal to sell his 43% share in Palace on Monday."
"Which quarter of a year Eagle Football Group announced debts of £422m?","['Last October, his Eagle Football Group, which owns a 77% stake in Lyon, announced debts of £422m.\nIn a statement, Lyon said the DNGC\'s decision was ""incomprehensible"" and confirmed they would appeal.\nLyon\'s relegation could prove significant to Crystal Palace\'s hopes of playing in the Europa League next season.\nTheir participation is currently in doubt because of Uefa rules, which prevent multiple teams under one multi-club ownership structure competing in the same European competition.', 'French club Lyon have been demoted to Ligue 2 because of the poor state of their finances.\nThe club were provisionally demoted by the DNGC, the body which oversees the accounts of French professional football clubs, in November.\nLyon officials including owner John Textor, met with the DNGC on Tuesday but failed to convince the body that the club had sufficiently improved their financial situation to lift the punishment.', 'Textor owns stakes in both clubs although he agreed a deal to sell his 43% share in Palace on Monday.']","Last October.
","On fourth quarter of a year Eagle Football Group announced debts of £422m.","0.5","0.7660030487205489","0.9999999999","1.0","[1] Last October, his Eagle Football Group, which owns a 77% stake in Lyon, announced debts of £422m.
In a statement, Lyon said the DNGC's decision was ""incomprehensible"" and confirmed they would appeal.
Lyon's relegation could prove significant to Crystal Palace's hopes of playing in the Europa League next season.
Their participation is currently in doubt because of Uefa rules, which prevent multiple teams under one multi-club ownership structure competing in the same European competition.
[2] French club Lyon have been demoted to Ligue 2 because of the poor state of their finances.
The club were provisionally demoted by the DNGC, the body which oversees the accounts of French professional football clubs, in November.
Lyon officials including owner John Textor, met with the DNGC on Tuesday but failed to convince the body that the club had sufficiently improved their financial situation to lift the punishment.
[3] Textor owns stakes in both clubs although he agreed a deal to sell his 43% share in Palace on Monday."
